Type,SORN ID,System Name,URL,PII
SORN,GSA/OAP-5,Federal Acquisition Institute (FAI) Online University.,https://www.federalregister.gov/documents/2008/04/25/E8-8929/privacy-act-of-1974-notice-of-updated-systems-of-records,"name, e-mail, home address including city, state, zip code, and country, business address including city, state, zip code, and country, home telephone number, business telephone number, home fax number, business fax number, affiliated organization, manager's e-mail, Training records, course type selection, course progress, course start date, course completion dates"
SORN,GSA/OCSIT-1,USA.gov,https://www.federalregister.gov/documents/2016/07/18/2016-16868/privacy-act-of-1974-notice-of-an-updated-system-of-records,"name, address, email, phone number, birth date, marital status, veteran status, small business owner status, parental status, student status"
SORN,GSA/OEA-1,Records of Defunct Agencies.,https://www.federalregister.gov/documents/2008/04/25/E8-8904/privacy-act-of-1974-notice-of-updated-systems-of-records%20%20,"time and attendance cards, payment vouchers, employee health benefit records, requests for deductions, tax forms, overtime requests, leave data, retirement records, vendor register, payment tapes"
SORN,GSA/OGC-1,Office of General Counsel Case Tracking and eDiscovery System,https://www.federalregister.gov/documents/2017/10/02/2017-20972/privacy-act-of-1974-system-of-records,"Name, social security number, home address, home phone number, email address, birth date, financial information, medical records, employment records"
SORN,GSA/OMA-1,E-PACS,https://www.federalregister.gov/documents/2014/12/19/2014-29719/privacy-act-of-1974-notice-of-updated-systems-of-records,"Photo, Full Cardholder Unique Identifier (CHUID), Public Key Infrastructure (PKI) Certificate, Card Authentication Key (CAK) Certificate, Full name, Person Classification, Badge Expiration Date, Card State, User Principal Name (UPN), Federal Agency Smart Card Number (FASC-N), Globally Unique Identifier (GUID)"
SORN,GSA/PBS- 8,Electronic Document Managing Software Platform (EDMS),https://www.federalregister.gov/documents/2010/05/26/2010-12683/privacy-act-of-1974-notice-of-new-system-of-records,"unsolicited resumes from the public, suitability adjudication letters, training documents, warrant documents, telecommute agreements."
SORN,GSA/PBS-5,eLease.,https://www.federalregister.gov/documents/2008/04/25/E8-8934/privacy-act-of-1974-notice-of-updated-systems-of-records,"information about leases, address, telephone number, Taxpayer Identification Number (TIN), e-mail, fax numbers, Social Security Number"
PIA,GSA/PBS-5,NBC Studley,https://www.gsa.gov/cdnstatic/NBC%20Studley%20_PIA_March2019.pdf,"Contact Information, Business Information, Financial Information, Social Security Numbers, Lessor Name, Lessor Address, Lessor Phone Number, Lessor Email Address (business or personal as applicable), Lessor Tax ID (if not a business this is their SSN), Financial Account Information (bank account information)"
PIA,GSA/PBS-5,Real Estate Taxes Portal (RET),https://www.gsa.gov/cdnstatic/Real%20Estate%20Taxes%20Portal%20(RET)%20PIA.pdf,"Names, Addresses, Tax ID Numbers (which may be SSN for small business owners), Business or Home Addresses of Property Owners, Phone Numbers, email address, name , region"
SORN,GSA/PBS-6,Electronic Acquisition System (EAS).,https://www.federalregister.gov/documents/2008/04/25/E8-8903/privacy-act-of-1974-notice-of-updated-systems-of-records,"information about contracts, address, telephone number, Taxpayer Identification Number (TIN), e-mail, fax numbers, Social Security Number"
PIA,GSA/PBS-7,The Museum System (TMS),https://www.gsa.gov/cdnstatic/The%20Museum%20System_PIA_FY19_December_2019.pdf,"Name, Date of birth, Place of birth, Current address, Website address, Home telephone number, Office/studio telephone number, Fax number, Contact information for gallery or other artist’s representative, U.S. Citizenship or permanent residence status confirmation"
SORN,GSA/PBS-7,The Museum System (TMS),https://www.federalregister.gov/documents/2010/05/20/2010-12039/privacy-act-of-1974-notice-of-new-system-of-records,"name, birth date, educational level, telephone number, street address, email address"
SORN,GSA/PPFM-1,Disbursement and Accounts Payable Files.,https://www.federalregister.gov/documents/2008/04/25/E8-8932/privacy-act-of-1974-notice-of-updated-systems-of-records,"name, address, telephone number, vendor identification number, banking information, Social Security number"
SORN,GSA/PPFM-10,Purchase Card Program.,https://www.federalregister.gov/documents/2008/04/25/E8-8910/privacy-act-of-1974-notice-of-updated-systems-of-records,"names, home telephone number, business telephone number, home address, business address, Social Security Numbers, date of birth, employment information, commercial and agency investigative reports showing debtors' asset, commercial and agency investigative reports showing debtors' liabilities, commercial and agency investigative reports showing debtors' income, commercial and agency investigative reports showing debtors' expenses, bankruptcy petitions, history of wage garnishments, repossessed property, tax liens, legal judgments on debts owed, financial delinquencies, charge card transactions, contractor monthly reports showing charges to individual account numbers, account balances, other data needed to authorize, account for, and pay authorized purchase card expenses"
PIA,GSA/PPFM-11,Ancillary Financial Application (AFA) system ,https://www.gsa.gov/cdnstatic/Ancillary_Financial_Applications_AFA_PIA.pdf,"Name, TIN, SSN, home address, home phone, e-mail address, bank account information, contract numbers, history of payments., DUNS Number, invoice number"
PIA,GSA/PPFM-12,ImageNow.,https://www.gsa.gov/cdnstatic/ImageNow_AFA_PIA.pdf,"employee name or other unique identifier, gender, birth date, age, marital status, spouse and dependents, home e-mail address, home address, home phone number, cell phone number, work phone number, health records, Social Security Number (SSN), (only captured in the image, not in the database) Employer Identification Number, payroll deductions, banking information, personal credit card information"
SORN,GSA/PPFM-12,ImageNow.,https://www.federalregister.gov/documents/2009/08/10/E9-19102/privacy-act-of-1974-notice-of-new-system-of-records," name, gender, birth date, age, marital status, spouse, dependents, home e-mail address, home address, home phone number, health record, Social Security Numbers, Employer Identification Numbers, payroll deductions, banking information, personal credit card information, similar personally identifiable information"
SORN,GSA/PPFM-6,Employee Credit Reports.,https://www.federalregister.gov/documents/2008/04/25/E8-8928/privacy-act-of-1974-notice-of-updated-systems-of-records,"name, address, age, number of dependents, name of employer, nature of business, position held, time position held, full or part-time employment, net worth and what it consists of, annual earned income, other income, reputation, credit record, financial records, personal history"
SORN,GSA/PPFM-7,Credit Data on Individual Debtors.,https://www.federalregister.gov/documents/2008/04/25/E8-8925/privacy-act-of-1974-notice-of-updated-systems-of-records,"information from commercial and agency investigative reports, names, taxpayer identification numbers (TINs), Social Security Numbers, employer identification numbers, debtor contact information,  work address, home address, work telephone number, home telephone number, name of employer, employer address, The owner, year, make, model, tag number and State of the vehicle, the driver's or owner's insurance company information, debt information"
SORN,GSA/PPFM-9,Payroll Accounting and Reporting (PAR) System.,https://www.federalregister.gov/documents/2008/04/25/E8-8920/privacy-act-of-1974-notice-of-updated-systems-of-records,"Employee's name, Social Security Number, date of birth, sex, work schedule, type of appointment, Service computation date for assigning leave, occupational series, position, grade, step, salary, award amounts, accounting distribution, Time and attendance, attendance, leave, Federal tax, State tax, local tax, allotments, savings bonds, other pay allowances and deductions, nature-of-action code, organization table, salary table, Information regarding court-ordered payments to support dependent children"
SORN,GSA/PPFM—3,Travel System,https://www.federalregister.gov/documents/2009/05/28/E9-12372/privacy-act-of-1974-revised-privacy-act-system-of-records,"name, Social Security Number, date of birth, gender, passport number, redress number, known traveler number, residence address, dependents names, dependents ages, duty stations, itinerary, credit data in the form of credit scores , commercial and agency investigative reports showing debtors assets, commercial and agency investigative reports showing debtors liabilities, commercial and agency investigative reports showing debtors income, commercial and agency investigative reports showing debtors expenses, bankruptcy petitions, history of wage garnishments, repossessed property, tax liens, legal judgments on debts owed, financial delinquencies"
SORN,GSA/TRANSIT-1,Transportation Benefits Records.,https://www.federalregister.gov/documents/2011/09/14/2011-23466/privacy-act-of-1974-notice-of-updated-systems-of-records,"name, home address, Social Security Number, work organization, work location, work zip code, work phone number, service computation date, mode of transportation, commuting costs"
SORN,GSA/TTS-1,Login.gov,https://www.federalregister.gov/documents/2017/08/10/2017-16852/privacy-act-of-1974-system-of-records,
PIA,OPM-GOVT 1,Human Resources IT Transition to Transformation (HR Links),https://www.gsa.gov/cdnstatic/HR%20Links%20PIA.pdf,"Name, Social Security Number (SSN), Employee Number, Date of Birth/Age, Home address Home telephone number, Race and National Origin data, Gender, Handicap Code, Birth Date, Marital Status, Reprimands and Warnings, Education History, Benefits, payroll, accounting, pay and leave entitlement records, payroll deduction and withholding,  time and attendance records, Home telephone number"
PIA,OPM-GOVT-5,GSAJOBS,https://www.gsa.gov/cdnstatic/GSAJOBS_PIA_December2018.pdf,"Name, Email Address, Home Address, Social Security Number (SSN) (Only last four digits are visible), Date of Birth, Home address and telephone number, Resume / Employment history, Race and National Origin data (optional**)"
PIA,OPM-GOVT-5,TTS Applicant Tracker,https://www.gsa.gov/cdnstatic/PEO_TTS%20Applicant%20Tracker%20PIA_October2018.pdf,"Preferred Name, Email , Best Phone Number, City, State, ZIP Code , Ability to work full- time (Y/N), Preferred Work location (Picklist), Veteran status"
PIA,System of Records Notice (SORN) - GSA/CEO-1,Hire EZ,https://www.gsa.gov/cdnstatic/20190618%20-%20Hire%20EZ%20PIA.pdf,"Name , Email Address, Home Address, Telephone Number, Resume / Employment history, Veteran and Citizenship Status , User and Online Information (e.g., LinkedIn)"
PIA,,Beta.SAM.gov,https://www.gsa.gov/cdnstatic/BetaSAM%20PIA%20.pdf,"business name, email address, telephone number, TIN, address, SSN"
PIA,,Challenge.gov,https://www.gsa.gov/cdnstatic/Challengegov%20PIA.pdf,"e-mail address, username, password, First and last name , Phone number, City, state and country, Website (e.g., school, company, Twitter or LinkedIN pages) , Photo or image, Biographical sketch of no more than 1,000 words, Additional skills and interests from a preset selection, Additional skills and images in a free form text box"
PIA,,Enterprise Application Services (EAS),https://www.gsa.gov/cdnstatic/20190603%20-%20Enterprise%20Application%20Service%20_EAS%20PIA_for%20posting.pdf,"adjudication notes, decisions, employment records, education history, credit history, the subject’s previous addresses, friends and associates, selective service records, military history, and citizenship"
PIA,,Enterprise Mobile Devices,https://www.gsa.gov/cdnstatic/Enterprise%20Mobile%20Devices%20PIA.pdf,"names, email address, phone number, mailing address, photos, credit card information"
PIA,,Federal Procurement Data System- New Generation (-NG),https://www.gsa.gov/cdnstatic/FPDS-NG_PIA_May2019.pdf,"Contractor Taxpayer Identification Number (TIN), Social Security Number (SSN), Contractor Name, Contractor Address, Place of Performance, Product or service provided, Socioeconomic Information about the Contractor"
PIA,,Fleet Management System (FMS),https://www.gsa.gov/cdnstatic/20181128%20-%20Fleet%20Management%20System_PIA_November2018.pdf,"Driver's First Name, Driver's Middle Initial, Driver's Last Name, Home Address (Street Number, City, State, Zip), Home Phone Number, Name of Insurance Company, Address of Insurance Company (Street Number, City, State, Zip), Insurance Company Point of Contact, Insurance Company Phone Number, Insurance Policy Number of Driver or Owner"
PIA,,ROCIS,https://www.gsa.gov/cdnstatic/20191125%20-%20ROCIS_PIA_signed.pdf,"Name, Agency, Title, Work Telephone, Work TDD, Work Fax, Work Email , Work Address, username (system generated), user number (system generated), password"
PIA,,Touchpoints,https://www.gsa.gov/cdnstatic/Touchpoint%20PIA_siged_1042019_webversion.pdf,"First Name , phone (optional), email address (optional)"
PIA,,TTS Data.gov,https://www.gsa.gov/cdnstatic/20200114%20-%20DATAgov_PIAdocx%20(1).pdf,"names, email addresses"